UC1 - Create AddressBook Database 

mysql> create database Address_Book_Service;
Query OK, 1 row affected (0.05 sec)

mysql> show databases;
+----------------------+
| Database             |
+----------------------+
| address_book_service |
| information_schema   |
| mysql                |
| payroll_service      |
| performance_schema   |
| sys                  |
+----------------------+
6 rows in set (0.00 sec)

--------------------------------------------------------------------------------------------------------

UC2 - Insert Data into Address Book Service Database 

> CREATE TABLE address_book_service (
    ->     first_name VARCHAR(50) NOT NULL,
    ->     last_name VARCHAR(50) NOT NULL,
    ->     address VARCHAR(255),
    ->     city VARCHAR(50),
    ->     state VARCHAR(50),
    ->     zip VARCHAR(50),
    ->     phone_no VARCHAR(50),
    ->     emailid VARCHAR(50)
    -> );
Query OK, 0 rows affected (0.16 sec)

----------------------------------------------------------------------------------------------------------------
UC3 - insert new Contacts to Address Book 

mysql> INSERT INTO address_book_service (first_name, last_name, address, city, state, zip, phone_no, emailid)
    -> VALUES
    ->     ('Amruta', 'Shinde', 'room no -56 sant kakkaya marg sion', 'mumbai', 'maharashtra', '400017', '8454853223', 'amruta@26'),
    ->     ('Naveen', 'Raj', 'B-Wing - shau nagar room no-5', 'mumbai', 'maharashtra', '400017', '8779223275', 'naveen@27'),
    ->     ('Neha', 'Patil', 'c-wing sakshi apartment room no-10', 'pune', 'maharashtra', '42587', '2587614985', 'neha@15'),
    ->     ('Shraddha', 'Yadav', 'rohan apartment A-Wing room no -02', 'nashik', 'maharashtra', '56482', '8795412598', 'shraddha@32');
Query OK, 4 rows affected (0.02 sec)
Records: 4  Duplicates: 0  Warnings: 0

-------------------------------------------------------------------------------------------------------------------

UC4 - edit existing contact person using their name 


mysql> UPDATE address_book_service SET address = 'ROOM NO -50 D-WING - NIVAS APARTMENT',phone_no='5552211144' WHERE first_name= 'Amruta' AND last_name = 'Shinde';
Query OK, 1 row affected (0.01 sec)
Rows matched: 1  Changed: 1  Warnings: 0

mysql>

-----------------------------------------------------------------------------------------------------------------

UC5 - Delete Existing Contacts From Address Book Service Table

mysql> DELETE FROM  address_book_service WHERE first_name ='Neha' AND last_name = 'Patil';
Query OK, 1 row affected (0.01 sec)

mysql>

mysql> SELECT * FROM address_book_service;
+------------+-----------+--------------------------------------+--------+-------------+--------+------------+-------------+
| first_name | last_name | address                              | city   | state       | zip    | phone_no   | emailid     |
+------------+-----------+--------------------------------------+--------+-------------+--------+------------+-------------+
| Amruta     | Shinde    | ROOM NO -50 D-WING - NIVAS APARTMENT | mumbai | maharashtra | 400017 | 5552211144 | amruta@26   |
| Naveen     | Raj       | B-Wing - shau nagar room no-5        | mumbai | maharashtra | 400017 | 8779223275 | naveen@27   |
| Shraddha   | Yadav     | rohan apartment A-Wing room no -02   | nashik | maharashtra | 56482  | 8795412598 | shraddha@32 |
+------------+-----------+--------------------------------------+--------+-------------+--------+------------+-------------+
3 rows in set (0.00 sec)

mysql>

---------------------------------------------------------------------------------------------------------------------

UC-6 - Retrieve Person belonging to a City or State from the Address Book

mysql> SELECT * FROM address_book_service WHERE city = 'mumbai' OR state = 'maharashtra';
+------------+-----------+--------------------------------------+--------+-------------+--------+------------+-------------+
| first_name | last_name | address                              | city   | state       | zip    | phone_no   | emailid     |
+------------+-----------+--------------------------------------+--------+-------------+--------+------------+-------------+
| Amruta     | Shinde    | ROOM NO -50 D-WING - NIVAS APARTMENT | mumbai | maharashtra | 400017 | 5552211144 | amruta@26   |
| Naveen     | Raj       | B-Wing - shau nagar room no-5        | mumbai | maharashtra | 400017 | 8779223275 | naveen@27   |
| Shraddha   | Yadav     | rohan apartment A-Wing room no -02   | nashik | maharashtra | 56482  | 8795412598 | shraddha@32 |
+------------+-----------+--------------------------------------+--------+-------------+--------+------------+-------------+
3 rows in set (0.00 sec)

mysql>


--------------------------------------------------------------------------------------------------------------------------

UC-7 - understand the size of address book by City and State

mysql> SELECT city, state, COUNT(*) AS contact_count
    -> FROM address_book_service
    -> GROUP BY city, state;
+--------+-------------+---------------+
| city   | state       | contact_count |
+--------+-------------+---------------+
| mumbai | maharashtra |             2 |
| nashik | maharashtra |             1 |
+--------+-------------+---------------+
2 rows in set (0.04 sec)

--------------------------------------------------------------------------------------------------------------------------

UC-8 - retrieve entries sorted alphabetically by Person’s name for a given city

mysql> SELECT first_name, last_name, address, city, state, zip, phone_no, emailid
    -> FROM address_book_service
    -> WHERE city = 'Mumbai'
    -> ORDER BY first_name, last_name;
+------------+-----------+--------------------------------------+--------+-------------+--------+------------+-----------+
| first_name | last_name | address                              | city   | state       | zip    | phone_no   | emailid   |
+------------+-----------+--------------------------------------+--------+-------------+--------+------------+-----------+
| Amruta     | Shinde    | ROOM NO -50 D-WING - NIVAS APARTMENT | mumbai | maharashtra | 400017 | 5552211144 | amruta@26 |
| Naveen     | Raj       | B-Wing - shau nagar room no-5        | mumbai | maharashtra | 400017 | 8779223275 | naveen@27 |
+------------+-----------+--------------------------------------+--------+-------------+--------+------------+-----------+
2 rows in set (0.04 sec)

mysql>

------------------------------------------------------------------------------------------------------------------------------

mysql> CREATE TABLE address_book1
    -> (
    ->  id INT AUTO_INCREMENT PRIMARY KEY,
    ->     name VARCHAR(255) NOT NULL,
    ->     type VARCHAR(255) NOT NULL
    -> );
Query OK, 0 rows affected (0.09 sec)

mysql> INSERT INTO address_book1 (name, type) VALUES
    -> ('Family Contacts','Family'),
    -> ('Work Contacts','Profession'),
    -> ('High School Friends','Friends');
Query OK, 3 rows affected (0.05 sec)
Records: 3  Duplicates: 0  Warnings: 0


mysql> SELECT * FROM address_book1;
+----+---------------------+------------+
| id | name                | type       |
+----+---------------------+------------+
|  1 | Family Contacts     | Family     |
|  2 | Work Contacts       | Profession |
|  3 | High School Friends | Friends    |
+----+---------------------+------------+
3 rows in set (0.00 sec)

mysql> ALTER TABLE address_book_service
    ->      ADD COLUMN type VARCHAR(255),
    -> ADD FOREIGN KEY(ID) REFERENCES address_book1(id);
Query OK, 3 rows affected (0.17 sec)
Records: 3  Duplicates: 0  Warnings: 0


mysql> SELECT * FROM address_book_service;
+----+------------+-----------+--------------------------------------+--------+-------------+--------+------------+-------------+------+
| id | first_name | last_name | address                              | city   | state       | zip    | phone_no   | emailid     | type |
+----+------------+-----------+--------------------------------------+--------+-------------+--------+------------+-------------+------+
|  1 | Amruta     | Shinde    | ROOM NO -50 D-WING - NIVAS APARTMENT | mumbai | maharashtra | 400017 | 5552211144 | amruta@26   | NULL |
|  2 | Naveen     | Raj       | B-Wing - shau nagar room no-5        | mumbai | maharashtra | 400017 | 8779223275 | naveen@27   | NULL |
|  3 | Shraddha   | Yadav     | rohan apartment A-Wing room no -02   | nashik | maharashtra | 56482  | 8795412598 | shraddha@32 | NULL |
+----+------------+-----------+--------------------------------------+--------+-------------+--------+------------+-------------+------+
3 rows in set (0.00 sec)

mysql> UPDATE address_book_service
    -> SET type = 'Profession'
    -> WHERE first_name = 'Amruta';
Query OK, 1 row affected (0.05 sec)
Rows matched: 1  Changed: 1  Warnings: 0

mysql>  UPDATE address_book_service
    -> SET type = 'Friends'
    -> WHERE first_name = 'Naveen';
Query OK, 1 row affected (0.05 sec)
Rows matched: 1  Changed: 1  Warnings: 0

mysql>  UPDATE address_book_service
    -> SET type = 'Family'
    -> WHERE first_name = 'Shraddha';
Query OK, 1 row affected (0.05 sec)
Rows matched: 1  Changed: 1  Warnings: 0

mysql> SELECT * FROM address_book_service;
+----+------------+-----------+--------------------------------------+--------+-------------+--------+------------+-------------+------------+
| id | first_name | last_name | address                              | city   | state       | zip    | phone_no   | emailid     | type       |
+----+------------+-----------+--------------------------------------+--------+-------------+--------+------------+-------------+------------+
|  1 | Amruta     | Shinde    | ROOM NO -50 D-WING - NIVAS APARTMENT | mumbai | maharashtra | 400017 | 5552211144 | amruta@26   | Profession |
|  2 | Naveen     | Raj       | B-Wing - shau nagar room no-5        | mumbai | maharashtra | 400017 | 8779223275 | naveen@27   | Friends    |
|  3 | Shraddha   | Yadav     | rohan apartment A-Wing room no -02   | nashik | maharashtra | 56482  | 8795412598 | shraddha@32 | Family     |
+----+------------+-----------+--------------------------------------+--------+-------------+--------+------------+-------------+------------+
3 rows in set (0.00 sec)

mysql>